{
  "$schema": "https://raw.githubusercontent.com/SolSolis-Sys/conductor-blueprints/main/schemas/blueprint.v1.json",
  "id": "solsolis/adversarial-review",
  "name": "adversarial-review",
  "version": "1.1.0",
  "title": "Adversarial Code Review Loop",
  "description": "Multi-perspective code review: one agent finds issues, N independent refuters try to disprove each. Only findings that survive the adversarial panel are reported.",
  "author": "SolSolis-Sys",
  "license": "MIT",
  "tags": ["review", "adversarial", "quality", "security"],
  "inputs": [
    { "name": "target", "type": "string", "description": "File or directory to review", "required": true },
    { "name": "dimensions", "type": "string", "description": "Review dimensions (comma-separated)", "default": "correctness,security,performance" },
    { "name": "refuters", "type": "number", "description": "Number of independent refuters per finding", "default": 3 },
    { "name": "min_votes_to_confirm", "type": "number", "description": "Refuters that must NOT refute to confirm finding as real", "default": 2 }
  ],
  "cost_profile": { "tier": "high", "avg_tokens_per_run": 80000, "estimated_cost_usd": 0.28 },
  "permissions": { "network": false, "filesystem": "read-only", "allowed_commands": [] },
  "agents": [
    {
      "role": "finder",
      "prompt": "Analyze {{target}} along these dimensions: {{dimensions}}. For each issue: file, line, severity (critical/high/medium/low), category, description, suggested fix. Be thorough — findings feed adversarial refuters."
    },
    {
      "role": "refuter",
      "count": "{{refuters}}",
      "prompt": "You are an adversarial reviewer. REFUTE this finding if possible: {{finding}}. Try to prove it is a false positive — wrong line, already handled, acceptable trade-off, or test-only code. Default to refuted=true when uncertain. Return: { refuted: bool, confidence: 0-1, reason: string }"
    },
    {
      "role": "synthesizer",
      "prompt": "Given findings and refutation votes, produce final report. A finding is CONFIRMED if at least {{min_votes_to_confirm}} refuters did NOT refute it. Group by severity. List filtered false positives separately."
    }
  ],
  "loop": {
    "exit_condition": "all findings processed by refuter panel and synthesizer",
    "max_rounds": 1
  }
}
