{
  "$schema": "https://raw.githubusercontent.com/SolSolis-Sys/conductor-blueprints/main/schemas/blueprint.v1.json",
  "id": "solsolis/self-skill-improvement",
  "name": "self-skill-improvement",
  "version": "1.0.0",
  "title": "Skill Self-Improvement Loop",
  "description": "Reads a SKILL.md file via deterministic tool step, analyzes quality, proposes improvements, then adversarial review decides ACCEPT_IMPROVED or KEEP_ORIGINAL.",
  "author": "SolSolis-Sys",
  "license": "MIT",
  "tags": ["skill", "self-improvement", "quality", "claude-code", "meta"],
  "inputs": [
    {
      "name": "skill_path",
      "type": "string",
      "required": true,
      "description": "Absolute path to the SKILL.md file to improve"
    },
    {
      "name": "quality_threshold",
      "type": "number",
      "required": false,
      "default": 4,
      "description": "Min quality score (1-5). Improvement only attempted when score < threshold."
    }
  ],
  "cost_profile": {
    "tier": "medium",
    "avg_tokens_per_run": 60000,
    "estimated_cost_usd": 0.18
  },
  "permissions": {
    "network": false,
    "filesystem": "read-only",
    "allowed_commands": ["node"]
  },
  "agents": [
    {
      "role": "file-reader",
      "type": "tool",
      "command": "node conductor://tools/read-file {{skill_path}}",
      "output_var": "skill_content",
      "timeout_ms": 5000,
      "on_failure": "abort"
    },
    {
      "role": "quality-analyzer",
      "prompt": "You are a quality auditor for Claude Code SKILL.md files.\n\nAnalyze this skill file and score it 1-5 on each dimension:\n1. Triggering: Are activation conditions clear and specific?\n2. Completeness: Are all steps, edge cases, and examples covered?\n3. Conciseness: Is it free of redundancy and padding?\n4. Actionability: Can an agent follow this exactly without ambiguity?\n5. Examples: Are there concrete before/after or input/output examples?\n\nReturn JSON:\n{\n  \"overall_score\": <average 1-5>,\n  \"scores\": { \"triggering\": <1-5>, \"completeness\": <1-5>, \"conciseness\": <1-5>, \"actionability\": <1-5>, \"examples\": <1-5> },\n  \"issues\": [{\"dimension\": \"...\", \"description\": \"...\", \"severity\": \"high|medium|low\"}],\n  \"strengths\": [\"...\"],\n  \"recommendation\": \"IMPROVE\" | \"KEEP\"\n}\n\nSkill file:\n{{skill_content}}"
    },
    {
      "role": "skill-improver",
      "condition": "quality-analyzer.overall_score < {{quality_threshold}}",
      "prompt": "You are an expert Claude Code skill author.\n\nImprove this SKILL.md based on the quality audit. Fix all HIGH severity issues. Keep the skill concise — do not add unnecessary sections.\n\nOriginal skill:\n{{skill_content}}\n\nAudit issues:\n{{quality-analyzer.issues}}\n\nReturn JSON:\n{\n  \"improved_content\": \"<full improved SKILL.md, ready to replace original>\",\n  \"changes\": [\"what changed and why\"]\n}"
    },
    {
      "role": "adversarial-reviewer",
      "condition": "quality-analyzer.overall_score < {{quality_threshold}}",
      "prompt": "You are a skeptical reviewer. Your job is to REJECT improvements that make things worse.\n\nCheck the proposed improvement against the original:\n- Did it introduce unnecessary complexity?\n- Are all examples accurate and runnable?\n- Did any correct sections regress?\n- Is it still concise?\n\nOriginal:\n{{skill_content}}\n\nProposed improvements:\n{{skill-improver.changes}}\n\nReturn JSON:\n{\n  \"issues\": [{\"type\": \"complexity|inaccuracy|regression|bloat\", \"description\": \"...\", \"severity\": \"critical|warning\"}],\n  \"verdict\": \"APPROVE\" | \"REVISE\"\n}"
    },
    {
      "role": "synthesizer",
      "prompt": "Make the final decision on skill improvement.\n\nQuality score: {{quality-analyzer.overall_score}} / 5 (threshold: {{quality_threshold}})\nRecommendation: {{quality-analyzer.recommendation}}\nAdversarial verdict: {{adversarial-reviewer.verdict}}\nAdversarial issues: {{adversarial-reviewer.issues}}\n\nRules:\n- If score >= threshold: final_verdict = KEEP_ORIGINAL (no improvement needed)\n- If adversarial verdict = REVISE with critical issues: final_verdict = KEEP_ORIGINAL\n- Otherwise: final_verdict = ACCEPT_IMPROVED\n\nReturn JSON:\n{\n  \"final_verdict\": \"ACCEPT_IMPROVED\" | \"KEEP_ORIGINAL\",\n  \"final_content\": \"<improved SKILL.md content, or 'Use original' if KEEP_ORIGINAL>\",\n  \"summary\": \"One sentence explaining the decision\"\n}"
    }
  ],
  "loop": {
    "exit_condition": "synthesizer produced final_verdict",
    "max_rounds": 1
  }
}
