{
  "$schema": "https://raw.githubusercontent.com/SolSolis-Sys/conductor-blueprints/main/schemas/blueprint.v1.json",
  "id": "solsolis/deploy-verify",
  "name": "deploy-verify",
  "version": "1.0.0",
  "title": "Deploy Verification Loop",
  "description": "After a deploy, polls health endpoints and runs smoke tests in a loop until stable or rollback threshold reached. Inspired by loops.elorm.xyz 'Deploy Verification Loop' pattern.",
  "author": "SolSolis-Sys",
  "license": "MIT",
  "tags": ["deploy", "verification", "health-check", "smoke-test", "devops"],
  "inputs": [
    { "name": "base_url", "type": "string", "description": "Deployed service base URL", "required": true },
    { "name": "health_path", "type": "string", "description": "Health check endpoint path", "default": "/health" },
    { "name": "smoke_tests", "type": "string", "description": "Comma-separated curl checks or npm test pattern to run", "default": "" },
    { "name": "stable_streak", "type": "number", "description": "Consecutive healthy checks required to declare success", "default": 3 },
    { "name": "poll_interval_seconds", "type": "number", "description": "Seconds between health checks", "default": 30 },
    { "name": "max_attempts", "type": "number", "description": "Max checks before declaring deploy failed", "default": 10 },
    { "name": "rollback_command", "type": "string", "description": "Command to run on failure (e.g. fly deploy --image previous)", "default": "" }
  ],
  "cost_profile": { "tier": "low", "avg_tokens_per_run": 8000, "estimated_cost_usd": 0.03 },
  "permissions": { "network": true, "filesystem": "read-only", "allowed_commands": ["curl", "npm test"] },
  "agents": [
    {
      "role": "health-checker",
      "prompt": "Check health of {{base_url}}{{health_path}} using curl with a 10s timeout. Return: status (up/down/degraded), http_code, response_time_ms, body_excerpt (first 200 chars)."
    },
    {
      "role": "smoke-runner",
      "condition": "health_checker.status == 'up' AND smoke_tests != ''",
      "prompt": "Run smoke tests against {{base_url}}. Tests to run: {{smoke_tests}}. For each: execute, capture exit code and output. Return: all_passed (bool), failures (list of test name + error)."
    },
    {
      "role": "rollback-trigger",
      "condition": "consecutive_failures >= max_attempts AND rollback_command != ''",
      "prompt": "Deploy verification failed after {{max_attempts}} attempts. Execute rollback: `{{rollback_command}}`. Report rollback outcome and notify human."
    }
  ],
  "loop": {
    "trigger": "post-deploy",
    "interval_seconds": "{{poll_interval_seconds}}",
    "exit_condition": "consecutive_healthy_checks >= {{stable_streak}} OR consecutive_failures >= {{max_attempts}}",
    "max_rounds": "{{max_attempts}}",
    "on_success": "report_stable",
    "on_failure": "trigger_rollback_agent"
  }
}
